dealer,bond_code,stance,inventory_fit_score,inventory_adjustment_bps,description,valid_from,valid_to,source
CITI,UST-10Y-2036,WANTS_TO_SELL,0.96,-1.2,CITI is axed to reduce 10Y duration inventory and is likely to show a tighter offer.,2026-04-28T09:30:00Z,,SIMULATED_PROPRIETARY
JPM,UST-10Y-2036,NEUTRAL,0.74,0.1,JPM has neutral UST-10Y inventory and should quote close to profile.,2026-04-28T09:30:00Z,,SIMULATED_PROPRIETARY
GS,UST-10Y-2036,WANTS_TO_BUY,0.52,1.0,GS wants to buy UST-10Y and is less competitive for a client BUY RFQ.,2026-04-28T09:30:00Z,,SIMULATED_PROPRIETARY
MS,UST-10Y-2036,LOW_BALANCE_SHEET,0.44,1.5,MS has higher balance-sheet cost for this duration bucket.,2026-04-28T09:30:00Z,,SIMULATED_PROPRIETARY
BARC,UST-10Y-2036,LOW_BALANCE_SHEET,0.36,1.8,BARC is included for price discovery with outlier latency and spread.,2026-04-28T09:30:00Z,,SIMULATED_PROPRIETARY
